{
  "schema_version": "closure_status_transition_receipt_v1",
  "package_id": "B1b",
  "package_revision": 1,
  "sequence": 2,
  "from_state": "planned",
  "to_state": "ready",
  "trigger_decision": "B1b implementation writer merged and became available for post-merge validation",
  "evidence": {"root": "repo", "path": "Tools/S8ReceiptChain/s8_g1_receipt.py", "sha256": "bab76b4f12105afe904987599b9a1323474574e808516c47c3369f7ebe2018da"},
  "repo_head": "a3160c88ff2cde29a4bf3e319330ee6d463fbc4f",
  "command_rc": 0,
  "reviewer": "commander"
}
